[
  {
    "id": "164",
    "nombre": "Fallo Agendar",
    "descripcion": "Hola Plascencia! Cómo estás?? Ya tenía buen rato que no nos escribimos!! Oye, sabes que estamos batallando de nuevo con EOS, el mismo error de siempre que al agendar, la hora se marca como “consumida”, pero no continúa su flujo normal :disappointed: no le aparece al experto ni...",
    "fase": "Deploy",
    "estado": "Resuelto",
    "porcentaje": 100,
    "propietario": "ArturoPlascenciaRodriguez",
    "enlaces": [
      {
        "label": "GitHub",
        "url": "https://github.com/RON-DATADRIVEN/eos-roadmap/issues/164"
      }
    ],
    "tipo": "bug"
  },
  {
    "id": "148",
    "nombre": "fix: Asignar tipo correcto a cada Issue creado automaticamente",
    "descripcion": "### Resumen Se requiere que al crear un Issue, este tenga el tipo correcto en projects de GitHUb",
    "fase": "Desarrollo",
    "estado": "Resuelto",
    "porcentaje": 100,
    "propietario": "ArturoPlascenciaRodriguez",
    "enlaces": [
      {
        "label": "GitHub",
        "url": "https://github.com/RON-DATADRIVEN/eos-roadmap/issues/148"
      }
    ],
    "tipo": "bug"
  },
  {
    "id": "162",
    "nombre": "Reporte Roto",
    "descripcion": "[Slack Message](https://emprendemostec.slack.com/archives/D09EUCP5QLW/p1761938488983449)",
    "fase": "Archivado",
    "estado": "Resuelto",
    "porcentaje": 100,
    "propietario": "ArturoPlascenciaRodriguez",
    "enlaces": [
      {
        "label": "GitHub",
        "url": "https://github.com/RON-DATADRIVEN/eos-roadmap/issues/162"
      }
    ],
    "tipo": "bug"
  },
  {
    "id": "163",
    "nombre": "Loguin roto",
    "descripcion": "Luis Antonio Palacios de la empresa Inmuebles Bamboo me dice que al entrar a la página web después de crear mi cuenta, me aparece en blanco.",
    "fase": "Deploy",
    "estado": "Resuelto",
    "porcentaje": 100,
    "propietario": "ArturoPlascenciaRodriguez",
    "enlaces": [
      {
        "label": "GitHub",
        "url": "https://github.com/RON-DATADRIVEN/eos-roadmap/issues/163"
      }
    ],
    "tipo": "bug"
  },
  {
    "id": "238",
    "nombre": "Corregir manejo real de CASSANDRA_PORT",
    "descripcion": "## Épica padre #194 Normalización de auditoría backend",
    "fase": "Desarrollo",
    "estado": "En atención",
    "porcentaje": 50,
    "propietario": "ArturoPlascenciaRodriguez",
    "inicio": "2026-04-27",
    "eta": "2026-05-10",
    "enlaces": [
      {
        "label": "GitHub",
        "url": "https://github.com/RON-DATADRIVEN/eos-roadmap/issues/238"
      }
    ],
    "tipo": "bug"
  },
  {
    "id": "292",
    "nombre": "fix(frontend): respetar PORT desde variables de entorno",
    "descripcion": "## Origen Pendiente detectado tras el cierre técnico de frontend staging.",
    "fase": "Reportados",
    "estado": "Reportado",
    "porcentaje": 0,
    "propietario": "Sin asignar",
    "enlaces": [
      {
        "label": "GitHub",
        "url": "https://github.com/RON-DATADRIVEN/eos-roadmap/issues/292"
      }
    ],
    "tipo": "bug"
  },
  {
    "id": "181",
    "nombre": "Orden en lista de programas iniciando en el ultimo creado por defecto.",
    "descripcion": "### Descripción Como gestor de programas de emprendimiento quiero ver el utlimo programa creado al inicio de la lista por defecto.",
    "fase": "Prototipado",
    "estado": "En prototipo",
    "porcentaje": 20,
    "propietario": "ArturoPlascenciaRodriguez",
    "enlaces": [
      {
        "label": "GitHub",
        "url": "https://github.com/RON-DATADRIVEN/eos-roadmap/issues/181"
      }
    ],
    "tipo": "feature"
  },
  {
    "id": "296",
    "nombre": "fix(backend): hacer obligatorio PUBLIC_FILES_BASE_URL fuera de local/dev",
    "descripcion": "## Origen Pendiente detectado tras el cierre de backend staging.",
    "fase": "Reportados",
    "estado": "Reportado",
    "porcentaje": 0,
    "propietario": "Sin asignar",
    "enlaces": [
      {
        "label": "GitHub",
        "url": "https://github.com/RON-DATADRIVEN/eos-roadmap/issues/296"
      }
    ],
    "tipo": "bug"
  },
  {
    "id": "306",
    "nombre": "fix(backend): corregir inconsistencia entre programas activos y consultarAll",
    "descripcion": "﻿## Contexto",
    "fase": "Reportados",
    "estado": "Reportado",
    "porcentaje": 0,
    "propietario": "Sin asignar",
    "enlaces": [
      {
        "label": "GitHub",
        "url": "https://github.com/RON-DATADRIVEN/eos-roadmap/issues/306"
      }
    ],
    "tipo": "bug"
  },
  {
    "id": "305",
    "nombre": "data(staging): corregir programas con imagen/logo undefined",
    "descripcion": "## Contexto",
    "fase": "Reportados",
    "estado": "Reportado",
    "porcentaje": 0,
    "propietario": "Sin asignar",
    "enlaces": [
      {
        "label": "GitHub",
        "url": "https://github.com/RON-DATADRIVEN/eos-roadmap/issues/305"
      }
    ],
    "tipo": "bug"
  },
  {
    "id": "299",
    "nombre": "fix(backend): configurar remitente SMTP en staging para invitaciones",
    "descripcion": "## Contexto",
    "fase": "Reportados",
    "estado": "Reportado",
    "porcentaje": 0,
    "propietario": "Sin asignar",
    "enlaces": [
      {
        "label": "GitHub",
        "url": "https://github.com/RON-DATADRIVEN/eos-roadmap/issues/299"
      }
    ],
    "tipo": "bug"
  },
  {
    "id": "300",
    "nombre": "fix(backend): normalizar respuestas vacías como arrays en staging",
    "descripcion": "## Contexto",
    "fase": "Reportados",
    "estado": "Reportado",
    "porcentaje": 0,
    "propietario": "Sin asignar",
    "enlaces": [
      {
        "label": "GitHub",
        "url": "https://github.com/RON-DATADRIVEN/eos-roadmap/issues/300"
      }
    ],
    "tipo": "bug"
  },
  {
    "id": "301",
    "nombre": "fix(frontend): robustecer vista de programa PM ante respuestas vacías o 404",
    "descripcion": "## Contexto",
    "fase": "Reportados",
    "estado": "Reportado",
    "porcentaje": 0,
    "propietario": "Sin asignar",
    "enlaces": [
      {
        "label": "GitHub",
        "url": "https://github.com/RON-DATADRIVEN/eos-roadmap/issues/301"
      }
    ],
    "tipo": "bug"
  },
  {
    "id": "302",
    "nombre": "fix(rbac): revisar si Program Manager debe poder agregar batches",
    "descripcion": "## Contexto",
    "fase": "Reportados",
    "estado": "Reportado",
    "porcentaje": 0,
    "propietario": "Sin asignar",
    "enlaces": [
      {
        "label": "GitHub",
        "url": "https://github.com/RON-DATADRIVEN/eos-roadmap/issues/302"
      }
    ],
    "tipo": "bug"
  }
]
